lindo desfile de isabela capeto. amei a inspiracao que foi no filme alice atraves do espelho   ,positivo
   so consigo lembrar  de tu e da anninha nesse frio e com esse filme/musica saudades de voces (,positivo
jogo do corinthians na libertadores e os cara indo em pre estreia de filme de heroi,negativo
so falta alguem pra passar os finais de semanas assistindo filme comigo mas ne ,negativo
tava assistindo o filme dai sai fui e no banheiroestou mijando olho pro lado e no chao do box do lado tinha uma moca sentadafiquei (),negativo
record fez dez mandamentos em novela em filme e agora musical,negativo
que filme fodaaaaaa,positivo
guerra civil estreia amanha  mds  companhias para ir assistir esse filme,positivo
melhor filme melhor trilha sonora melhor compositor. ,positivo
to aq vendo filme e perdendo o jogo,negativo
magnus bane amor da minha vida nos livrosno filme e mais ainda na serie,positivo
so eu nao gosto de filme 3d aff ,negativo
meu pai tem o dom de comecar assistir o filme quando ta no final assim nao da ne kirido,negativo
n tenho fofa vou ver filme mrm ,positivo
vou jantar e ver um filme aqui com meus irmaos ,positivo
gnt filme de romance e muito chato como vcs consegue acaba sempre igual,negativo
bia deveria dormir aqui em casa pra ver filme cmg ,neutro
so pq gostei de um filme ele nao veio pra sjc,negativo
 e depois desse ainda vai ter um filme de tubarao possuido,neutro
personagem d filme d terror tem mais e q morrer mesmo,negativo
 acho quw o clipe vai ser a cena do filme,neutro
minha mae ta assistindo vhs o filme e muito pesado so quero ver a cara dela de horror ,negativo
 arrasouu.... eu ja disse e vou repetir.. vou chorar horrores nesse filme ,positivo
amo esse filme cara  ,positivo
 acho que poltergeist so nao teve assinatura dos 2 diretores pq o sindicato nao permitiu; e um filme da dupla,neutro
pra quem leu o livro e gostou vale a pena assistir o filme e conferir essa baita critica. e o melhor ja esta ,positivo
posso assistir cartas para julieta mil vezes mas eu nunca vou deixar de gostar desse filme ele e perfeito,positivo
que filme doido que a gnt viu hoj,positivo
o filme foi bom nao chorei mas gostei,positivo
 mas acho que se vc morasse perto de mim iria na sua casa todos os dias assistir um filme e te abracar    ( ^^),positivo
eu vo te que i no cinema assisti esse filme,positivo
juro p vcs que se em civil war comecarem a discutir do meu lado sobre qual homem aranha e o melhor no meio do filme vou atacar,negativo
mainha me barrou de sair por causa da greve. n vai ter filme,negativo
que susto minha irma respirou tres vezes uma respiracao de filme de ferro credooooo,negativo
ja assisti kill bill mil vzs e n canso pense num filme do carai,positivo
gnt to mt nervosa c esse filme,negativo
 melho filme puta q paro mana unica unidade de medida memo eh o tempu,positivo
vou assisti um filme e comer chocolate,neutro
eu n resisto a um filme com o miles meu homem,positivo
eu lembro da gente ali dividindo um acai juntos num fim de semana e um filme pra distrair,positivo
record tbm quando baixa numa coisa nao larga mais. tudo agora dos dez mandamentos; novela filme peca  sera que ja tem o cereal matinal,negativo
mariana ximenes linda no lancamento do filme  onde faz par com armando babaioff. ,positivo
iae novinha vamos ver um filme la em casa kk bora bora ,positivo
 kkkkk kkk vou pisar ate nas velha q quiser ver meu filme,negativo
 o foda eh que quando vc entende a ordem cronologica ja passou grande parte do filme e vc ja ta totalmente desnorteada,negativo
quero me acabar no chocolate e assistir algum filme jaja,positivo
eu sempre escolho filme de terror p ver e depois me cago,negativo
vamos no cinema no mes de agosto em um dia chuvoso assistir um filme de comedia e dar uns beijos,positivo
amo esse filme ,positivo
o bom de assistir filme de terror com a namorada e que voce pode abraca-la se cagando de medo e ela vai achar que e algo romantico.,negativo
to vendo filme sozinho tranquilao ..,positivo
alala as donas do filme alao ,positivo
nois quer brusinha nois quer ir ver filme nois quer ir nos shows dos idolo mas nois faz alguma coisa p pagar tudo isso isso mesmo nao,negativo
ter a venus em touro e tipo aquela cena de sex and the cita (filme) que a samantha quer trepar com sushi pelo corpo.,negativo
tem coisa pior do que filme de cachorro que fala ,negativo
acho muito paia quando ficam conversando ao inves de prestar atencao no filme.,negativo
 au mds kjkkkkkkk quero assistir um filme,positivo
a duff assisti recentemente mas esse filme mudou a minha vidatao maravilhosolindoconfesso q me iludo achando q vai acontecer o msm cmg,negativo
o primeiro encontro entre um pai com alzheimer e sua filhao filme mostra um suposto primeiro encontro entre uma... ,neutro
n queima o meu filme poxa  ,negativo
qual eh o filme fav de vcs do studio ghibli,neutro
oxe filme do capitao america e tu vai com blusa do home aranha mae vc n ta entendendo,negativo
 inclusive tao fazendo uma serie sobre o filme e ela vai reprisar o papel lt;3,neutro
to vendo um filme responsa,positivo
que filme lindo pqp,positivo
vou dixava um e vou ver filme,positivo
mama o unico filme de terror em que nao teve final totalmente feliz  ,neutro
vou ver um filme se eu nao dormir no meio dele como sempre hahahahah,positivo
essa vida de fa de quadrinhos n ta sendo facil pq esse ano tem filme demais,positivo
   problematizacao dos viloes de filme de terror,neutro
assitir serie gt; assistir o filme de literatura,positivo
  e tao horrivel que fiquei em baixo das cobertas com chocolate vendo filme hoje ,positivo
amigo tem esse link aqui sobre parte do motivo do filme e bem simples so um texto etc  ,neutro
frio chocolate quente banho quente filme pipoca. quem precisa de namorado na verdade eu preciso,positivo
so uns cafune um chocolate quente e um filme,positivo
to vendo vingadores e gente como vcs conseguem nao perder o controle da vida vendo esse filme eu fico louca,positivo
 cidade de papel ksks nao vi o filme so pra ler o livro,positivo
bora assistir um filme porque nao to afim de jogo nao,neutro
quem deveria ta vendo um filme de fisica molecular,positivo
ter a venus em touro e tipo aquela cena de sex and the city (o filme) que a samantha quer trepar com sushi espalhado pelo corpo.,negativo
no filme da vida eu sou o dono da barraca de frutas que os carros destroem na cena de perseguicao.,negativo
melhor que esse frio so ver filme nesse frio,positivo
 filme a torcida do remo,positivo
pfvr so nao me deem spoiler sobre o filme pfvr,negativo
acabei de ver o filme da frida e nao consigo entender como alguem pode ser tao foda,positivo
que filme lindo ,positivo
meu deus bom filmecuidado com o infarto ,positivo
e eu espero q o filme n me decepcione,negativo
sempre ao seu lado mas eu choro em muito filme mano ,positivo
vo ver um filme aki,neutro
 apenas para presidente. isso se a chapa dilma-temer cair antes do filme do ano. se nao e eleicao indireta pelo congresso /,negativo
gostei de um video   filme completo dublado em portugues,positivo
e agora eu ja to na faculdade e nada do filme ela disse na minha cara que fallen virou lenda,negativo
aaaaah sim.. agr vou assistir um filme p distrair ,positivo
  ah porra isso no final dos filmes mas na historia deles mesmo ambos sao humanos quando morrem ja era,negativo
filme ponto de vista e muito bom pra quem faz letras analise do discurso pura,positivo
to olhando um filme,neutro
one direction lanca outro filme pro squad do rio ir junto,positivo
to vendo um filme com a penny nao sei o nome da atriz e to amando a personagem mas ela vai morrew,positivo
meus amigos nao decidem que filme querem ver provavelmente nao vai dar pra ver civil war com eles pq eles so compram ingresso na hora aff,negativo
vei eu amo a  fazendo filme romantico serio. ela e a melhor pessoa do mundo pra filme romantico gente,positivo
 saiu do filme,neutro
 vivo esperando o famigerado filme,positivo
vou me deitar pra ver um filme e dormir flw,positivo
meus unicos desejos sao que venha a 4o temporada do vai que cola e o filme minha mae e uma peca 2 hahahhaha,positivo
to triste pq nao vou pra estreia do filme amanha ,negativo
assistir seu filme favorito ,positivo
vou ve um filme ,neutro
 mais obrigada pelo  filme vou ver se assisto mais tarde,positivo
cartas para julieta  amo esse filme,positivo
 so se rolar um filme ou prison break,positivo
temos a ma ra vi lho sa  materia sobre o filme do capitao america e do outro lado temos os signosssss,positivo
e bom pra um filme conchinha pipoca coberta mais so em casa e a pessoa cade,positivo
 aaaaaa to vendo esse filme tbm mas n to apx nao ,neutro
nem falei p minha mae que a isa vai assistir o filme com a gentw,positivo
 qual filme,neutro
pior pessoa p ver filme junto e a lo q n sai do celular odeio esse tipo de gente,negativo
eu to me sentido em um filme mas sabe aquela hr do filme q ta tudo cagado ta dando tudo errado e a personagem so se fode entao,negativo
esses filme sao muito louco dms kkkk,positivo
  tem criancas vendo seus videos elas n vem filme de terror brinks axo legal,positivo
fei o filme do exorcistas do vaticano e zikaaa slc,negativo
queria ta mexendo no pc mas meu pai quis assistir filme suave dx pra amanha,positivo
 ah entendi / mas ce nao ficou focada porque o filme e chato,negativo
to tao de saco cheio q noss viu acho q vou ver filme na netflix,negativo
acabou o filme agora vou assistir bob esponja,positivo
filme filmefilme,neutro
so quero que esse filme comece logo ,positivo
ja era meu filme e minha paz,positivo
meu sonho e acabar o filme 3d. odeio filme 3d me cobre o mesmo preco mas me ofereca filme 2d.,negativo
nunca fiquei tao empolgado para assistir um filme,positivo
to embaixo das cobertas assistindo filme,neutro
to assistindo simplesmente acontece pela 4 vez nao me canso desse filme e muito lindo ,positivo
amo esse filme amo dakota amo,positivo
gostei de um video  de   deus nao esta morto filme completo dublado,positivo
 lembra daquele filme que os cara tava morto la em um monte de porta nao sei explicar,neutro
 advinha qual filme eu to vendo,positivo
esse filme e sensacional socorro,positivo
 assisti um filme muito bom hj geracao prozac mas vou comecar assistir vikings ou sons of anarchy..,positivo
evan peters nesse filme ja to aqui sonhando,positivo
vamos ver se esse filme e bom,neutro
filme do sbt vence talk show da concorrencia e alcanca lideranca por 44 minutos ,neutro
botando na minha cabeca que tenho tempo livre pro filme e nao preciso estudar hoje,neutro
eu queria assistir um filme com minha namorada nesse frio. alguem me indica uma namorada,neutro
coraline e o segundo melhor filme infantil  ,positivo
imagina como deve ser dormitorio de exo no frio td mundo vai se juntando numa cama so onde antes tava kyungsoo vendo uns filme tranquilo,positivo
amo assistir filme,positivo
5 horas pra escolher a merda do filme,negativo
 e impossivel nao chorar vendo esse filme,positivo
vou ver filme flw,positivo
tava vendo filme mas tenho q ir dormi ja vai da 22h,neutro
vou assistir um filme,neutro
tava bem estudando fisica ai a minha mae vem e fala  larga isso ai vamos ver um filme e comer brigadeiro  amo essa mulher,positivo
estou vendo filme cm o teilor e a jubeica da caroline,positivo
assistir filme nesse frio,positivo
a sua miga quer ver o filme dublado,negativo
q droga o filme tava tao legal,negativo
vou assistir um filme,neutro
 kkkkkkk tomara ne so nao pode ser sonso e querer assistir o filme,positivo
 fiaspoaki vc podia fazer um video de 15 referencias q vc nn percebeu no filme pixels.q nn vc fez do detona ralph.vc e foda,negativo
vou fazer pipoca doce e assistir um filme com o baby,positivo
ala as blusinha do filme e eu aqui,negativo
amanha so entro na internet depois do filme,negativo
me inscrevi p vestibular mas n consigo ver esse filme,negativo
drama pra mim e so em filme,positivo
filmeeeeeeer ,positivo
 chinatown e linda mas a minha favorita ainda e o tema de ilia de jornada nas estrelas o filme. ,positivo
assistindo um filme ,neutro
esse frio ta bom pra assistir filme e ficar embaixo de edredom.,positivo
como assim filme novo de gantz .-.,positivo
devo dizer que o filme ta ficando bem legal ,positivo
hoje vou virar a madrugada assistindo varios filme,positivo
[shinee ao ir dormir na sua casa]jonghyuneu nao estou com sono jagiya quer ver um filme podemos ficar abracados ,negativo
  nos spams sobre o filme dele,neutro
   vamos assistir esse filme -,neutro
site oficial do filme dude e inaugurado ,neutro
se rolar um cao mais intenso ainda filme,positivo
comecei a ver o filme do trabalho de historia depois me entreguei e fui procurar um resumo porque eu nao era obrigada,negativo
to vendo q vou dormir no meio do filme,negativo
olhar filme com a mae e muito fera,positivo
vou chegar em casa e ficar deitadinha assistindo filme ,positivo
vai comecar finalmente 18 agora melhor filmeeeerr ,positivo
quero assistir filme de terror,neutro
vontade de assistir um filme com alguem ,positivo
vou baixr nerdcast sobre o filme batman vs super man,neutro
 n ele sofreu um acidente bem tenso nas filmagens do filme,negativo
cancela esse filme ,negativo
quero cafune dormir de conchinha assistir filme agarradinhamas nao quero um namorado vai entender,positivo
essa teoria de que no filme dos power rangers a rita seria a green ranger e na verdade muito boa. mas nao teriam culhoes de fazer acho.,positivo
explicacao enemy filme google search,neutro
meu primo perguntou pro meu irmao se ele ia ver o filme mais esperado do ano (civil war) ele disse que nao e que nao era o mais esperado,negativo
minha familia na sala assistindo filmee eu aquino celularna cozinhanesse frio do caralho,negativo
vou e ver um filme e dormir,positivo
 o livro e basicamente um resumo do filme a historia mesmo e original da hq nao,neutro
vi um pedacinho do video do filme era uma vez e ja comecei a chorar,positivo
se um filme me recordar troque o canal e so desligar,negativo
a sensacao de nao ter nenhum contato e a mesma de atuar no filme naufragio,negativo
  acho que e a mae dele que faz a maldicao no primeiro ou segundo filme n lembro direito,neutro
vou ver um filme ,neutro
sou apaixonada pelo frio amo esse tempinho. vontade de passar o dia todo na cama vendo filme de ,positivo
gostei de um video  ao america guerra civil - o filme mais esperado do ano,positivo
tenho que ta gritando pra ela acordar depois da metade do filme ,negativo
melhor filme ,positivo
rafael dirigindo scania streamline efetuou a entrega de rolos de papel filme na empresa posped.  ,neutro
  cinema amanha com os amigos estreia de um filme  me salve ,positivo
to conseguindo assistir td no netflix menos o filme q eu qria fui fala pro meu pai ele disse q e deus me castigando pela minha tatu satanica,negativo
faz 20m que o filme acabou e eu nao paro de suar pelos olhos,positivo
amo assistir filme c ele,positivo
nunca mais assisti um filme do jackie chan uma pessoa normal assiste pelo menos uns 30 filme dele por ano,positivo
vou ver um filme e dormi sabe .. ,neutro
aqui estou eu deitada assistindo filme e tomando chocolate quente que cliche,positivo
vai queimar meu filme,negativo
gostei de um video  de superdearo  nao assista esse filme - rubber o pneu assassino,positivo
hibernei hoje de tarde para poder estudar para prova de amanha de madrugada quando chegar do filme kkkkkkk,positivo
esse filme acaba comigo vou tentar dormir ,negativo
mae quero muito ver esse filme (era guerra civil) filha voce esta regredindo,positivo
 o filme e lindo,positivo
assisto esse filme 200 vezes choro as 200 vezes,positivo
to vendo um filme de terror muito fodaaaaaa,positivo
algumas fotos de becky como trini sua personagem no filme power rangers ,neutro
scream e a melhor serie derivada de filme que eu ja vi ,positivo
 quer extrair d qualquer jeito o  d todas as formas em novela serie filme musical agora so falta o livro,positivo
 vsf eu amo esse filme,positivo
tava vendo cartas para julieta  eu amo esse filme num nivel surreal,positivo
quero muito ver o filme como eu era antes de voce ,positivo
na verdade eu me comparei com ela o filme inteiro essa mulher superou o diabo gente,positivo
 mas o primeiro tambem lt;333 pisa no filme sem mais,positivo
 pra mim foi meio magico ver o filme porque eu nunca tinha visto o original,positivo
me da um poster do novo filme nunca te pedi nada  ,positivo
 mas perai.. sabe quanto vai ta o ingresso desse filme pra segunda,positivo
preciso ver esse filme do matt,positivo
   daqui a pouco vai rolar textao no face precisamos falar sobre os viloes de filmes de terror,positivo
esse filme finalmente 18 merece um oscar pqp gusnkdhudgtdsidhjdjsjsj,positivo
eu vendo filme e comentando mentalmente puta se fudeu tomou muito no cu ,positivo
o primeiro encontro entre um pai com alzheimer e sua filhao filme mostra um suposto primeiro encontro entre ,neutro
demora do filme comecar,negativo
to vendo filme,neutro
 quero ler o livro antes do filme  vou ja atras disso kkkkk,positivo
frio = sem insetos no quarto frio = sem calor chatofrio = sem suor frio = roupas estilosas frio = chocolate cobertor filmefrio = vida,positivo
marketing de filme porno e muito engracado,positivo
 e aquela nova foto do filme que saiuto chocada,positivo
voce esta ansioso para o filme,positivo
essas horas queria estar com meu pretinho assistindo um filme mas nao.. tenho 1 milhao de coisa pra fazer ,negativo
filme mt bom rs,positivo
vizinhos e o melhor filme do zac,positivo
terror pra mim e filme fofa. ,positivo
esse filme a ressaca 2 e engracado mds ,positivo
 espero que valha colocar minha virgindade em risco por esse filme.,negativo
to baixando um filme p eu ver amanha na aula ,negativo
um amor eterno por esse filme ,positivo
to vendo filme q o meu mozaum participa  ai to amando vou chorar pena q ele morre ,positivo
chocolate quente cobertor e um filme ,positivo
amanha e o dia que vou me privar de todas as redes sociais possiveis pq sei que os bbks vao soltar altos spoilers do filme,negativo
encontro com aurea maranhao que estreia seu filme prova de coragem com grande elenco ainda esse ano. ,neutro
 bom filme,positivo
onde vcs veem serie/filme online,neutro
 eu to muuuuuitoooo ansiosa pro filme e amanha sai novo trailer,positivo
''tu fica com cara de secretaria de filme porno com esse oculos'',negativo
vcs ja viram hard candy e um filme muito bom pra quem romantiza namoro com garotinhas pre-adolescentes (ou seja pedofilia),negativo
 e ainda vamos pras gravacoes do segundo filme e ficamos de figurantes kkkkkkk,negativo
vamos ver quais sao as duas opcoes de filme no cinema dessa gigante cidade kkkkkkkkk,negativo
 teria sido melhor ir ver o filme do pele,negativo
aquele momento que voce assiste um filme tao incrivel que quer conhecer o diretor o roterista e todo mundo q trabalhou na producao do filme,positivo
ver um filme debaixo das cobertas nesse friozinho e tudo de bom,positivo
vo ve um filme boa noite a todas,neutro
mujica e o golpe ja vimos esse filme ,negativo
to vendo um filme muito zoado,negativo
see you again e aquela musica de um filme epico pra tu ouvir pro resto da vida,positivo
so tenho que achar minha camisa do homem aranha ne mores nao vou assistir um filme desses sem essa camisa,positivo
queria entender porque os filme doido so passa quando nos nao pode ver ,negativo
a bruna inventa de querer assisti filme explica mil coisas na hora do jogo ,negativo
nao queima meu filme idiota,negativo
saudade de ir no mercado de pantufa e pijama comer torrada e cafe com voce assistir filme ate de madruga  ,positivo
to doidaaa p ve esse filme,positivo
to vnd  filme e estava com muita fome agora  ai o  acaba de bater na minha porta com um xtudo e refri.,positivo
to aqui deitada assistindo um filme com saudade do meu namorado,positivo
sexta queria ir no cinema so que nem vo vou deixar pra assistir quand o filme sair em dvd nao gosto de ir pro cinema,negativo
mujica e o golpe ja vimos esse filme ,negativo
 gabrielaaa se vira e lembra o nosso filme te odeio,negativo
filme sobre o lutador jose aldo ganha primeiro trailer; baseado em uma historia real mais forte qu  ,neutro
estou com uma louca impressao de que ja assisti esse filme,positivo
ai eu estava assistindo filme e ela me chamou no quarto pra mim mostrar pra ela o moletom que eu queria kkkkk,negativo
vou ficar vendo filme  ate a yasmim chegar,positivo
assistir cidade de deus 10 anos depois filme online dublado ,positivo
vou olhar filme beijos,neutro
so vou ve esse filme msm por causa do iron,positivo
aquelas cenas de filme onde a mulher se realiza indo pro provador com os bracos cheios de roupas nao me representa.,negativo
nao podemos esquecer de ter respeito ao proximo e a todos do fandom mesmo que voce esteja morrendo de vontade de falar algo sobre o filme,negativo
que filme mais romantico,positivo
esse friozinho e tao bom pra ficar deitadinha vendo um filme,positivo
batemos um bom papo  vimos filme e  comemos  deu p matar a sdds da amiga prima. ,positivo
a luana e do tipo que o cara convida ela pra ver um filme na casa dele e ela realmente vai achando que eles vao ver filme,negativo
 o filme todo e,neutro
esse filme ,positivo
sdds ir no cinema ver filme de terror ,positivo
to avisando logo se chegarem amanha dando spoiler e falando do filme eu nao respondo por mim  ,negativo
frio/filme/salgadinho ( rodrigues house) ,positivo
minha irma aqui me tirando so pq to vendo o filme simplesmente acontece  denovo,negativo
assistir filme em cinema/casa ,positivo
 douanne tb ia na estreia do filme e nao foram ,negativo
q filme lindo e esse,positivo
 ia falar do feriado agora hahahaacho que vou fazer um calendario que nem preso de filme,positivo
vou pra curitiba td diaqual o nome do filme  entrando numa fria,positivo
eu tenho filme pra caralho pra ver ainda e eu aqui moscando,positivo
acabei de assistir um filme muito foda,positivo
netflix e a ferramenta perfeita pra alguem deprimido continuar deprimido depois de se entreter brevemente com um filme qualquer,positivo
  nao filha a melhor coisa no frio tambem e correr ouvir uma musica top como se estivesse num filme em ny,positivo
 carai tu gosde filme jovem libertinagem junkie pitaria msm ne ja deve ter visto trainspotting (),positivo
filme de terror e vida ,positivo
  na vdd atencao para o plot e um dos simbolos do filme quinto elemento,neutro
amiga vem dormir cmg no findi ligo a lareira compro um vinhao e uns filme e faco petit gateau obg bjs ,positivo
gostei do filme q o prof d artes passou  finalmente consegui ver,positivo
um filme que o cara la morre e o cachorro dele fica esperando ele  ,positivo
vem aqui em casa pra gente assistir um filme ,positivo
eu preocupada com o filme e ela com o brinde nunca vi uma pessoa assim ,negativo
pessoal entrou no hype pro novo filme  que  estreia amanha debate... ,positivo
melhor filme desse mundo ,positivo
so faltou um filme responsa,negativo
acho que sou a pessoa que mais assisti filme kkkk,positivo
 qual filme,neutro
eu to criando tanta expectativa no filme guerra civil que to ate com medo kkkkkk,positivo
filme ja ta acabando e eu nem prestei atencao,negativo
melhor filme ,positivo
 esse filme e mto bom.. choro pra kct,positivo
vamo curti um filme  ,positivo
 esse filme e essa musica 0,positivo
aberta temporada de mensagens  vamos assistir um filme juntos ,positivo
se voce fica mto tempo sem assiti filme do jackie chan logo aparecem os problema de saude dor de cabeca e no peito fadiga febre,negativo
assistir filme em cinema/casa ,positivo
viver um filme dps ,positivo
mano ate o 50 cent no filme nao existeee,positivo
vou ver um filme aqui sabe..,neutro
santos na final do paulistao contra um time ''pequeno'' hueheuehue eu ja vi esse filme acho que foi em 2014 esse filme se chama ituano,negativo
vao ver filme,neutro
resumo de ontem curso casa do rafa comida mais comida filme filme porno insinuacao de sexo com urso de peluciaraspando minha barriga,positivo
vo me levanta cozinha toma banho estuda um pouco e olha filme,neutro
de qual filme voce seria o protogonista faca o teste e descubra ,neutro
 eu particularmente se tratando de livro em chamas. mas de filme e aep2,positivo
nos podia ta aqui debaixo da coberta vendo um filme comendo ou ate fazendo um sexo mas vc nao colabora ,negativo
mano colocou filme de terrornao consigo ver direito bem gripado aqui   ,negativo
pra mim civil war e sim o filme mais esperado nao sei pra vcs,positivo
e seca ou prefere ver uma novelinha um filme,positivo
to vendo filme com o tutuba ,neutro
se tao em economia e quiserem um filme com graca q n faz pensar mt e gostarem do tyrion de got vejam o filme the boss,positivo
estudei um pouco daqui a pouco vou ver um filme,neutro
 mais no filme ele vai cortar o cabelo,neutro
ir pro cinema no frio assistir um filme que voce goste e na estreia ,positivo
 to com a minha irma vendo um filme de peixinhos kkkk ,positivo
 ja esta a venda a continuacao o filme sai em agosto aguardando ansiosamente.,positivo
tenho q baixar musica acabar de ver o filme acabar a tmp de pll ;-;,positivo
nao estou entendendo nada nesse filme nada nadaaaaa,negativo
  vai os dois pra me acariciar durante o filme pronto,positivo
vi   ese   filme  ontem,neutro
eu quero ve eu quero ve eu preciso ve eu..necessito ve esse filme  ,positivo
 sexta to chegando prepara o filme e as pipocas,positivo
eu estou em outra aba o filme comeca na outra do nada uns barulho esquisito no fone ja bate o cagaco,negativo
quero muito ver esse filme ,positivo
nesse filme colegas os down sao safados,positivo
vou ver um filme e dps dormirgracas a deus amanha n tem aula.,neutro
ou seja ninguem liga se voce vai ver o filme se ja viu ou se ta vendo. nao. precisa. dar. spoiler.,negativo
nem vi esse filme mas ja sei tudo q acontece,negativo
queria ve um filme so nao sei qual  opinioes ,neutro
veja um trailer de guardians of the night filme russo de vampiros  ,neutro
assistirei o filme por motivos demarvelpantera negrahomem-aranha,positivo
