 tao enredo de filme porno do bra hahahaha oi vim arrumar sua maqsexo mas n foi de boa nd sexy e eu segurando meu cachorro,negativo
 n e possivelme conta algo esse tal filme do carreta furacao e verdade,positivo
alguem me fala algum filme dhr p mim assistir ,neutro
td filme q eu vejo tem cenas q bate cm a minha vida,positivo
 injustice e um otimo jogo .. superman fica louco e escraviza a humanidade tem o filme desse jogo no youtube  ;-],positivo
filme chocolate quente cobertor touca ta quase perfeito,positivo
 ahahhaha se n for pra assistir filme de terror nem kero,negativo
tomara que o spider vire casaca no filme que nem virou na hq quero muito ver isso,positivo
 parece aquele et do filme,negativo
dhavi n para quieton da nem p prestar atencao no filme ,negativo
gostei de um video  ao america guerra civil - o filme mais esperado do ano,positivo
essa pizza e esse filme de terror nesse frio esta top ,positivo
as vantagens de ser invisivel que filme que filme,positivo
minha vida parece aquele filme do 007 em que e sempre um novo dia para morrer,negativo
eu quero filme que nao acabe do nada eh isso q eu quero,negativo
so um chocolate quente uma boa companhia e um filme ne hahah,positivo
frio = filmefrio = durmi agarradinha com o mofrio = vida,positivo
 o livro eu nao sei se eu leria mas o filme me chamou atencao,positivo
voce sabe quando sua amiga e sua amiga mesmo quando ela canta seis aulas com voce as musicas do filme encantada e da clarice falcao,positivo
 espero q o filme seja muito bom pq ta frio e eu vou pro shopping assistir daqui poucas horas,positivo
 ainda mais vendo filme de terror juntos ai fudeu,positivo
filme de terror e vida ne nao,positivo
 nossa eu ja vi esse filme tantas vezes que acho que sei todas as falas hahahaha,positivo
nunca sei que filme assistir no netflix pois julgo pelas capas e acho quase todas zoadas,negativo
queria um amorzin tipo esses de filme de romance,positivo
hj a gente assistiu um filme mt ''foda'' kkkkkkkkkkkk,positivo
eita trust ta no netflix qto tempo q  vi esse filme,positivo
  acho justo uma sessao de filme de terror,positivo
  era 25 no ano passado so o de filme que era de 20,positivo
tanta coisa boa pra ver no netflix e minha mae ta vendo o filme do resident evil.,negativo
minha mae nao presta atencao no filme mexendo no celular afffff,negativo
agora tenho esse filme em casa. =d,positivo
assistu um filme de et ontem me caguei toda ora dormir depois,negativo
a cada dia ele vive um capitulo  protagoniza seu filme sem titulo,positivo
 vi o filme.,neutro
n e possivel q vou ter que sair de casa 18hrs pra ir ver civil war sendo que o filme comeca 22hrs o que eu nao faco por esse filme n e mesmo,positivo
vou assistir um filme com o estevao agora   ,neutro
 kkkk sem contar q nem sei se vou sobreviver depois desse filme,positivo
gostei de um video   online o filme 2 ( ep 1 ) especial 10k de inscritos inscritos,positivo
meu pai reclamando que amanha ele tem reuniao 09h da manha e que eu vou ferrar com ele por causa do filme hoje,negativo
e so pra avisar ceis acham que o stark vai bater no rogers no proprio filme dele kkkkkkkkkkkkk  na veia lt;3,positivo
um edredom 1 filme bom no frio de agosto,positivo
pq q eu choro em td filme romantico ,positivo
 eu me recuso a ver aquele filme no cinema hauhuahuahua,negativo
 meu filme,neutro
queria ver um filme hoje mas que nao seja 10 coisas que odeio em voce. e o favorito mas 2 vezes na semana nao da,positivo
eles nao vao ver o filme dai eu peco o ingresso deles e ligo pra minha mae e minha irma,positivo
sexta quero ir no cinema quero ver filme de terror se passar amem se nao passar fdc ,positivo
fui no shopping hoje ja comprei meu ingresso pro filme amanha,positivo
 em filme fica tudo ainda mais estreito,negativo
amanha o gabriel que vai escolher o filme vai colocar galinha pintadinha ctz,positivo
esse filme e engracado  eu e minha vo so da risada ,positivo
gente do ceu o cacador e a rainha do gelo e muito foda e o filme mds ajsnsnsnnssnjsjsj todos os personagens sao incriveis,positivo
filme fascinante sobre o trabalho inovador realizado pela psiquiatra nise da silveira (gloria pires) com doentes ,positivo
fica agarradinha com o jonathan vendo filme. ,positivo
quero ver filme mas tbm quero dormir e tbm comer ou tomar banho e ser rica tbm,positivo
esse trailer no novo filme do coringa a piada mortal ta muito foda,positivo
lari manoela e joao gui estrelam clip inspirado no filme grease para   ,positivo
queria ver um filme pq to sem sono porem nao tenho ideia de qual ,negativo
saudade de ir no mercado de pantufa e pijama comer torradinhas e tomar muito cafe dormir juntas assistir filme ate a madruga ,positivo
um friozinho uma cama um edredom um filme so p completar uma companhia,positivo
mano chorei horrores agora com um filme,positivo
queria companhia p assistir esse filme comigo mas o guilherme consegue ser mais medroso que eu ,negativo
 7h27 adoro esse filme ,positivo
amanha a professora vai passar um filme na sala nesse frio mds nem queria,positivo
 inda bem. passou mas ja to de novo sahsuh. n perdeu nada so foi filme e correcao do exercicio,positivo
esse filme vai me matar,positivo
vou assistir um filme de terror aqui,neutro
depois de ter chorado tudo o que tinha pra chorar no novo filme do nicholas sparks vou-me rir com a chloe e a charlotte em geordie shore,positivo
nenhum filme bom passando,negativo
esse filme   ,neutro
to querendo ver um filme,neutro
vou dormir aqui na prada pedimos pizza e vamos ver filme,neutro
 desculpe mais eu nao acho o filme errado ,positivo
estou lancando meu filme uma trouxa em acao.,negativo
puta que pariu colocaram se enlouquecer nao se apaixone no netflix eu to passando mal do tanto que amo esse filme,positivo
tava passando 2001 no max hoje tinha esquecido do quao incrivel e esse filme.,positivo
q filme bem lindo,positivo
 tira o olho meu avenger preferido e filme dele so mais pra frente,positivo
 gente melhor coisa  cobertas banho quente cafe filme moletom ,positivo
onde os fracos nao tem vez  filme pika sem cutcharra  hahahaha,positivo
sou tao viciado em filme de guerra que as vezes da vontade de sair dando tiro na rua com minha cetra,positivo
se eu tivesse recebido hoje ia passar la no chopptime e assistir filme legal,positivo
gostei de um video  de cahbytes  ratchet amp; clank 1 - o jogo baseado no filme que foi baseado no,positivo
por um mundo em que eu tenha alguem para assistir esse filme comigo ,positivo
queria assistir filme comendo meu diamante negro mas estou tao cheia q so d pensar ja me da vontade de por td p fora ,negativo
ela e um filme de acao com varios finais,neutro
to vendo filme ,neutro
minha mae fez voz de crianca e mds que medo parece aquelas vozes de criancas de filme de terror,negativo
vo ve um filme rs,neutro
a vida ta tao loka que as amigas da minha cunhada tao vindo me pedir indicacao de filme hauaahauahauahauahauah que,positivo
divulgado primeiro trailer de filme que conta historia de edward snowden ,neutro
pela primeira vez nao vou tomar spoiler de filme de heroi obrigado deus,positivo
aaaaaag meu dues esse eh sem duvidas meu filme favorito,positivo
to indo dormir esse filme eu ja vi e todos nos sabemos como vai acabar hahahahaha,negativo
pior ainda quando falam titulo em ingles de filme que nao e nem em ingles,negativo
gostei de um video  de   injustica deuses entre nos - o filme (dublado),positivo
 vendo filme entao ,neutro
sei que viu acorda uma 02 hrs da manha mesmo e aproveito pra assistir o filme,positivo
vou ver um filme aqui,neutro
toda a treta do filme foi culpa do homem de ferro,negativo
 verdade chega da batedeira quando penso nisso esse filme eu bo chora,positivo
e voce ja viu o clipe ta todo trabalhado no filme grease clique  ,neutro
so queria uma palha e assitir um filme agarrado,positivo
uns filme agr ia bemm,positivo
 sim mas no final ele nao se vinga eu fiquei osim e remake de it e jogos mortais 8 mano vai ter mto filme de terror lindo,positivo
 eu num queria ver mas eh um filme q todos querem ver ai se eu nao ve vo fica bem loca entendendo nada,negativo
to assistindo filme aqui de boas e enrolada nas cobertasqueria so compartilhar,positivo
a segunda paixao platonica foi a kristen bell por causa de um filme da sessao da tarde / ,positivo
o filme chega a emocionar teve uma criancinha na minha frente que comecou a bater palmas para o filme e isso foi bem legal de ver.,positivo
porra  globo fdp . em ves de passae um filme  vai passar jogo do vasco ,negativo
ir sexta comprar o ingresso de guerra civil pra assistir o filme so no domingo,positivo
como seria o poster do filme da sua vida ,positivo
so um bolo de cenoura com chocolate e um filme esse tempo pede ,positivo
sdd de ir no mercado de pantufa e pijama comer torradinhas e tomar muito cafe dormir juntas assistir filme ate a madruga  ,positivo
pegamo um copao de sorvete p ficar de boas na cama vendo filme ela tomou o sorvete sozinha em menos de 5min,positivo
achei um filme bem dahora que comecou agr,positivo
me pede qualquer coisa menos p sair de casa da p assistir tanto filme de terror c esse clima,negativo
ja vi esse filme ,negativo
vai passar it follows q filme ruim meu deus,negativo
 estamos vendo o filme panico palhacada 4 so pode,negativo
rosanesvartmanfinal da novela  filme dio como ti amo eliza cantando pro arthur.,neutro
tava aqui assistindo um filme e mais um gol da alemanha.,negativo
como vou assistir esse filme com o sono que eu to aqui ,negativo
amanha nois tem prova qq nois vai fazer assistir filme e focar no ppda,negativo
vou assistir um filme no netflix,neutro
finalmente 18 q filme loko,positivo
 quando eu terminar te dou a minha opiniao final. o filme ta com cara de que vai ser bom.,positivo
assistir filme ,neutro
eu chamo a gigih pra ver filme cmg eu coloco deus nao esta morto e ela chora pq quer alvin e os esquilos,negativo
gente pera ai o eddie foi visto em paris o que quer dizer q eles estao filmando o segundo filme de animais fantasticossocorro,positivo
vou me arrumar pra deitar tomar outro remedio e assistir filme,neutro
minha mae botou um filme de terror aqui do jeito que eu gosto esquece,positivo
vi um filme achando que era massa porem nao,negativo
o tempo passa e cartas para julieta continua sendo o meu filme preferido ,positivo
pedindo pra pessoa assistir o meu filme preferido comigo e ela negando. o k a y,negativo
fiaspofaz um video de estilo aquele das 15 referencias no detona ralph mais agora faz com o filme pixels q tambem tem varias referencias,negativo
o filme a bruxa tem uma trilha sonora de foder gostei muito. mas e um filme que eu nao assistiria de novo.,positivo
 o filme inteiro contra. gostei ate a parte que o carinha la se suicidou e o principal largou tudo. gostei mto.,negativo
esse tempinho pede uma companhia pra assistir um filme agarradinho brigadeiro e pipoca  ,positivo
quando voce assisti um filme foda de lindo ,positivo
tipo ela comentou sobre um filme que semana passada disse a algumas pessoas que queria ver,negativo
gente vejam o acordo que filme foda,positivo
minha mae botou um filme de terror aqui do jeito que eu gosto rs,positivo
queria um cineminha mas se sabado rolar um filme em casa com brigadeiro ou um potao de pipoca vou amar tambem,positivo
nem li todo guerra civil.. c amanha ja e o filme,positivo
odeio a dolores umbridge ate em outros filmes euaheua,negativo
4kids culturatm nickelodeon estreia o filme rufus ,neutro
filme acabou agora,neutro
se esse filme nao for bom eu vou ficar puto viu,negativo
se bem que desconfio que o final desse filme vai ser igual a batmanxsuperman veremos.,negativo
 desidratei com esse filme as criancas do meu lado no cinema nao entendiam nada kkkkkk,positivo
 e um filme feeling pra caralho,positivo
hoje a noite vai ser boa vou dormir sozinha por filme de terror e tremer de medo/frio,positivo
 awn mds que lindaeu amo esse filme tu n imagina. ,positivo
nem acredito que ja e amanha que estreia o filme to muito ansioso parece que comprei o ingresso a poucos dias e amanha ja e o filme,positivo
fight club que filme e esse mano ,positivo
 ver um filme,neutro
preciso de tudo a mais cara mais fic masi filme mais tudo. ja disse mais fic sera que o seu humano aqui e viciada hum nao sabemos,positivo
 achei bem fracas tbm. eu optaria pelas escolhas de liz gilbert em comer rezar amar. hahahah mas eu adorei a indicacao do filme,negativo
to chorosa quero ver o filme agora,negativo
vou jantar e assistir um filme,neutro
estou muito cansado nao sei se vou aguentar ver o filme,negativo
ja viram o novo filme corno - o retorno ,positivo
um filme no now ta 1699 dilmas que absurdo e esse gente credo,negativo
 nerds amanha estreia o novo filme da  - capitao america guerra civil  nos e a galera da ,neutro
kkk e  so que nn  kkk so em filme mesmo  ,positivo
assistir filme  ,neutro
ver um filme,neutro
acho q vou assistir mais um filme,neutro
vou ver um filme ve se anima,positivo
assisti um filme dos anos 80 hoje acho que nasci na decada errada,positivo
e tem que lembrar tambem que comentarios sobre o filme eh diferente de spoilers e quando eu chegar do cinema eu vou comentar sim,negativo
to assistindo um filme mtt bom com a minha mae ,positivo
o tempo ta tao bom pra dormir e ver um filme,positivo
vo me deita e olha um filme,neutro
o filme paro wtf,negativo
hoje aconteceu aquele tipo de coisa que voce nunca imaginaria que aconteceria com voce coisa que voce ve em filme e da merda dps,negativo
cade a namorada  o filme ja vai comecar  af,negativo
tem guerra civil filme com a troian filme com a shay e eu sem dinheiro,negativo
tava assistindo cartas para julieta eu amo esse filmeja vi umas mil vezes e assito mais umas mil vezes de novo,positivo
mammys me comprou uma blusa do cap pra assistir o filme amanha  me sentirei uniformizada porem amando ,positivo
assisto edp e o filme inteiro fico dumbledore nao pq anoaooanao cada vez que vejo ele,positivo
o filme nem cmc e eu ja comi tudo a pipoca ,negativo
nao quero ver esse filme sozinha)-,positivo
 eu nao curto filme assim mas vamo na luta,negativo
ja vi esse filme. se chama a hora do desespero. quer de todo jeito prende o outro.  ,neutro
2 me recomendou um filme hoje vou assistir dps kk,neutro
  assite until dawn e um jogo de suspence que e meio que um filme  tem no youtube e de 5 hrs tambem tem amor e aventura top ,positivo
aqui em casa todo mundo quer ver filme no netflix mas ajudar a pagar que e bom nada,negativo
recomendo d+ esse filme   ,positivo
o filme bom,positivo
achei se eu ficar (filme) muito chato desculpa mundo,positivo
como assim eu so fui assistir sociedade dos poetas mortos depois de 16 anos de vida e o filme mais lindo do planeta,positivo
club disney brasiltm disney marvel tera total controle criativo sobre o novo filme do homem-aranha ,neutro
nossa minha nossa eu fiquei animado pro filme do snowden,positivo
finalmente adiantando minha leitura de guerra civil minha meta e terminar amanha antes do filme   ,positivo
 esse filme e maravilhoso lt;333 e varias metaforas otimas etc aff amo to triste que nao tive tempo pra assistir,positivo
fabiano me arrastou pro cinema e ate que eu gostei do filme hehehe,positivo
vou olhar um filme,neutro
so passa esse filme na record e a mumia ,negativo
sexta japinha e filme fechadao,positivo
amo esse filme lt;3  ,positivo
quarta nao passa nada de bom na tv  era a favor de passar filme todos os dias,negativo
 exatooo vamos fazer uma ponta no filme igual a vivienne fez no primeiro,positivo
 sim cara pelo menos pra um filme ficou fraco tlgd parece animacao de serie kkkkkk igual aquela liga da justica sem limites,negativo
gabriel tem uma galera querendo ver esse filme tambem pode ir com a gente  ,positivo
aaa ese   filme   me tras lagrima ,positivo
esse frio chegou agr e so ficar em casa comendo debaixo do edredom varios filme sem ngm pra variar  sdds 31/2 ,positivo
q filme pika mano ,positivo
queria um filme bonitinho pra ver,positivo
 ela gostava tb vcs ficaram falando la de filme dele,positivo
ainda nao fui assistir bvs justamente por causa das 2h30 de filme que eu nao sei de onde vou tirar,positivo
 e maravilhoso sofri tanto com esse filme q nem sei,positivo
que frio gostoso pra assistir um bom filme de terror ,positivo
saiu o filme do deadpool em 1080p ,neutro
ai voce vai ver um filme de terro e quando o filme acaba voce pensa serio que era isso vey,negativo
que filme e esse incrivel de mais lt;3,positivo
  o importante e prestar atencao no filme,positivo
alguem vem aqui pra casa ver filme comigo ,neutro
eu quero ver um filme triste e chorar,positivo
frio pra mim so e bom pra dormir e assisti filme,positivo
eita ai comeca a dar aquela ansiedade pre marvel filme,positivo
   vamos la dicas de filme alguem indica um,neutro
cade a mor  o filme ja vai comecar  aveee,negativo
 meu netflix ta rodando em 4k os filme que ta disponivel vc tem nocao disso fora os joguinhos roda tudinho lt;333333,positivo
ai fia vai passar seu filme sexta a mumia,positivo
  ah eu nem.procurei o filme.ta aqui ,positivo
falem filme bons pra eu assistir ai,neutro
 que filme maravilhoso amei demais agora que venha o 2,positivo
terminei minha resenha do filme deu uma estudada por cima amanha seja o que os deuses do olimpo quiser,negativo
passei a tarde toda vendo filme,positivo
nao supero esse filme,positivo
o  esta a levar muita porrada mas e um filme que transformou um personagem branco num negro e um personagem homem numa mulher.,positivo
 filme de terror sozinha nao da,negativo
 oqqqqqqmas um filme. acho q seria mais um documentario,positivo
porra vi agora o trailer do filme do pele,positivo
depois de assistir um puta filme sobre esquizofrenia a licao que fica e viver e arriscar,positivo
to so aguardando 00h pra ver o filme,positivo
brilho eterno de uma mente sem lembrancas e o filme mais foda que existe,positivo
achei meu filme  a novica rebelde ,positivo
mas tarde vou ver filme pelo cel,positivo
 ce nao vai ve filme comigo entao,positivo
odeio querer ver o filme e o comercial demorar 1ano p acabar ,negativo
ja ta na hora do filme,positivo
ta grande filme,positivo
eu to chorando com esse filme,positivo
 no final d filme qnd o cara chorou kkkk,positivo
os meninos vao ver a guerra civil hj na pre estreia amanha na escola vao contar o filme todo,positivo
licao ou deitar assistir serie/filme e pipoca mano,positivo
ela e um filme de acoes com varios finais,positivo
  nao mas eu quero ficar em casa assistindo filme,positivo
nao lembro a ultima vez que fiquei tao ansiosa para um filme,positivo
to olhando um filme ,neutro
pedi um lanche pra acompanhar com o filme.. tega rs ,positivo
transformers 4  estudio e processado por nao colocar publicidade suficiente no filme ,negativo
o nome do filme e a bruxa mas a unica coisa que penso quando lembro dele e pedofilia (algo que me incomodou bastante),negativo
 eu vi o trailler daquele a bruxa e fiquei mega uou que foda mas dai o povo todo reclamando e nao dei mais essa foda pro filme,negativo
 acho que estou sofrendo mais com esse filme do que com o fim do meu namoro,negativo
house of cards era um filme ta passando na tv.,neutro
vou ver esse filme e nanar,neutro
so preciso de companhia pra assistir filme ficar debaixo das cobertas e comer brigadeiro ,positivo
vou assistir algum filme,positivo
 nao gosto de filme ficcao de acao e essas ladainhas ai,negativo
o filme parece q vai ser mto bom mas vamos ver o quanto proximo da realidade sera ,positivo
 queimando meu filme ne q falta de respeito,negativo
netflix ta lotado d filme pessimo e serie desatualizada. da uma melhorada ae q n aguento mais essa porra ,negativo
cartas para julieta e um filme maravilhoso nao me canso de ver ,positivo
ate hoje n consigo assistir esse filme de puro medo que eu tenho,negativo
trailler de ex-men e capitao america antes do filme comecar so pra me deixar com mais vontade. quero muito ver os dois,positivo
nesta mesma epoca ano passado eu estava curtindo o frio de sao paulo e assistindo filme errado no cinema com a  saudade,neutro
pra assistir com filme,neutro
oi amigas vamo cancela os roles e fazer um amontuado na mha cama vendo filme e serie,positivo
bolococa e pipoca.. hoje eu vou ver filme a madrugada toda. ,positivo
consequencia do filme de hoje aposto,negativo
 vai olha um filme ou dormi pq teu time nem esta jogando beijinhosss ,negativo
pipoca filme bolo brigadeirotudo oh uma uva,positivo
que filme top,positivo
a arte de colocar no filme mais trash que estiver passando na tv e nao e trash stemily pls segura as ppks,negativo
 tentando fazer o kauan assistir um filme,positivo
nao passa um filme bom nessa gato net,negativo
filme vota na kefera viado ,negativo
ta passando um filme aqui sinistro. deus n livre ,negativo
vou logo assistir um filme ,neutro
unica coisa que me motiva a ver o filme do snowden e que o  sera interpretado pelo zachary quinto.,positivo
 eu vi o trailer tb mas o filme naotavam fazendo mo divulgacao pra esse filme,neutro
vou assistir um filme ,neutro
 eles vao contar essa historia no filme  podre espero que preste,negativo
esse filme ponto de vista e mt bom fazia tempo q eu n via,positivo
tomara que amanha continue esse frio  filme pipoca chocolate vamo pula a parte da itubaina pq ne ,positivo
coloquei um filme pra assistir com meu papis  o concurso,positivo
 aquela famosa depressao que se instala quando a gente lembra q esse ano nao tem filme novo nao tem premiere n tem nada triste,negativo
chega em casa vou toma um banho gelado e pega uma coberta e senta no sofa e ver um filme..,neutro
 vi sim e muito show se o bergman filmasse o setimo selo em tempos modernos ele teria a fotografia desse filme lt;3,positivo
a jubs do canal quem me conhece sabe tentou me desmascarar no desafio que filme e esse -gt;  ve la,positivo
 sim agr que tem esse filme na netflix tbm fiz kdjsk mas nunca uso,positivo
caralho o filme do matt vai lancar bem no dia do meu aniverario jkkeniensowpeidbensloejnelsld,positivo
 to vendo filme com minha prime e vc,positivo
tem cada filme doido jesus,positivo
sabado tem festinha migo ta mandando foto das bira mas na real eu so queria ficar em baixo das cobertas vendo filme,positivo
 nao tive aula nem curso fiquei em casa dia todo vendo filme e comendo kkk e o seu,positivo
quero ver alguem filme bom,neutro
  gente. as morte da serie greys anatomy. eu juro q filme nenhum me faz chorar mas essa serie   . . .. .,positivo
aquele filme de terror no friozinho gostoso ,positivo
os menino tao na sala vendo um filme que os tiroteios parecem mais uma maquina de costura remendando os agasalhos pro inverno,positivo
certeza q e meu filme preferido,positivo
cheguei da faculdade ja morrendo mas to feliz e to tristequero ver filme romantico pra choraracho q vou ver pure love,positivo
  sozinha no frio e para sempre minha vida ta uma bosta mas acho que o frio erra otimo para ver filme e chorar. ,negativo
vai comecar um filme no tc premium que fala de uma grta que eh possuida por uma forca maligna e essa parada passa atraves do sexo +,positivo
comer rezar amar e com certeza o meu filme,positivo
filme bom mas nao to entendendo md,positivo
esse filme e tao ,positivo
obrigada pelas risadas do debate sobre filme de terror,negativo
hoje comeca aquele momento de evita redes sociais para nao fica sabendo nada do filme ( capitao america - guerra civil)  ate domingo zzzzzzz,negativo
esse frio pede narguile  filme . mo  ,positivo
queria assistir um filme mas tambem queria dormir cedo,neutro
to vendo filme com o pai depoiis vou ir dormir,neutro
filme foda atras do outro kkkkkkkk finalmente 18,positivo
quero ver um filme,neutro
sessao de filme ruim e com eles mesmo,negativo
vamo dar ums bjo depois assistir um filme com esse friozinho debaixo do edredom,positivo
q bosta de filme o cara nao mata a guria logo puta mwrda,negativo
vou colocar um filme pra ver nesse frio super combina,positivo
gosto muito desse filme do frank sinatra kk nao sei pq,positivo
vou ver um filme,neutro
voce le um livro. imagina os personagens de um jeito. o livro vira filme. os atores escolhidos sao completamente diferentes do que imaginou.,negativo
parece q a alergia passou quando comecei a terminar de ver o filme que me instigou a semana inteira.,negativo
meu pai so escolhe filme foda,positivo
vamos passar a noite acordada ne  baixando filme pra namorada ,positivo
muito foda foda mesmo que filme foda,positivo
to deitada aqui na cama da mae vendo um filme,neutro
como eu quero ver esse filme  ,positivo
 tendi mas conta como filme solto ou como continuacao dos vingadores,neutro
 to explodida ja passando mal e dps tem filme q vai acabar la pelas 3h da manha ent eu sei q eu vou ir pro cursim so pra dormi,negativo
vou assistir guerra civil so semana que vem  espero que nenhum mal amado venha contar o filme . obrigada,negativo
minha vida ta se resumindo em ve filme,positivo
so esse filme,positivo
 vc assistiu o filme a nojenta nem para limpar ela serve. e a galera aplaudiu ,negativo
ficar deitada vendo filme nao tem coisa melhor  ,positivo
slc que filme sinistro nao to entendendo kk,negativo
 kkkkkkkkk acha q ta num filme,negativo
a coisa que mais gostei no filme 'a bruxa' foi o bodinho (black phillip) achei uma graca. queria ele pra mim. ,positivo
aquele vicio de assistir o msm filme ou serie mil vezes e nao enjoar quem nunca ,positivo
melhor parte do filme kkkkkkk  ,positivo
se eu ficar - que filme lindo  ,positivo
odeio quando tem cancao na serie/filme,negativo
vou meter um rango e olhar um filme no noooot ,neutro
amanha tem a estreia do filme guerra civil nos cinemas streamhaironshazam ,neutro
meu professor de redacao conseguiu arranjar ingressos por 17 reais pra nossa turma assistir ao filme cw amanha pena que nao vou,negativo
queria muito ver esse filme amanha po,positivo
adoro filme de desastres,positivo
vou ver o filme ai,neutro
o filme de olivier assayas sobre o movimento estudantil de maio de 68 em depois de maio ,neutro
um filme de terror chamado sair do banho quente pra conta de luz nao ficar cara,negativo
esse filme e mt pikaaaa,positivo
